{"checks":[{"category":"executability","evidence_refs":["fixture-design:unexecuted"],"metrics":{},"reason":"Contract illustration has no executed risk probe.","status":"FAIL","thresholds":{}},{"category":"coverage","evidence_refs":["fixture-design:unexecuted"],"metrics":{},"reason":"Contract illustration has no executed risk probe.","status":"FAIL","thresholds":{}},{"category":"assumptions","evidence_refs":["fixture-design:unexecuted"],"metrics":{},"reason":"Contract illustration has no executed risk probe.","status":"FAIL","thresholds":{}},{"category":"degeneracy","evidence_refs":["fixture-design:unexecuted"],"metrics":{},"reason":"Contract illustration has no executed risk probe.","status":"FAIL","thresholds":{}},{"category":"perturbation","evidence_refs":["fixture-design:unexecuted"],"metrics":{},"reason":"Contract illustration has no executed risk probe.","status":"FAIL","thresholds":{}},{"category":"scale","evidence_refs":["fixture-design:unexecuted"],"metrics":{},"reason":"Contract illustration has no executed risk probe.","status":"FAIL","thresholds":{}}],"method_id":"affine-main","question_id":"Q1","run_id":"not-executed-example","schema_version":"2.0","verdict":"FAIL"}
